id,title,authors,abstract,categories,published,url,resource_uri,no,total_results
2606.15489v1,Orbital-optimized spin-adapted multistate contracted VQE for excited states and properties on quantum hardware,"['Erik Rosendahl Kjellgren', 'Karl Michael Ziems', 'Peter Reinholdt', 'Stephan P. A. Sauer', 'Sonia Coriani', 'Jacob Kongsted']","We introduce the orbital-optimized multistate contracted variational quantum eigensolver (oo-MC-VQE) method with spin-adapted operators for the computation of ground and excited states, as well as state-specific and transition properties. The use of spin-adapted operators ensures that the spin symmetry of the reference states is conserved throughout the VQE optimization. In multistate variational approaches, achieving a balanced description of an increasing number of electronic states places growing demands on the expressibility of the underlying ansatz, thereby introducing a fundamental trade-off between accuracy and circuit complexity. We consider the effects of this trade-off explicitly and find that the number of circuit parameters required to obtain accurate results is reported to scale approximately linearly in the number of states. We further present an explicit quantum-circuit implementation of the oo-MC-VQE method and demonstrate its integration with quantum error mitigation techniques. Finally, we execute the method on real quantum devices to compute absorption spectra for two benchmark molecular systems.",['quant-ph'],2026-06-13T21:58:59+00:00,https://arxiv.org/pdf/2606.15489v1,arxiv://2606.15489v1,15,20
2606.17095v1,Variational Quantum Eigensolver-Based Quantum Bootstrap Embedding for Molecules,['Derek Peng'],"Simulating strongly correlated molecular systems on near-term quantum hardware remains challenging due to modern hardware's limited quantum volume and moderate-fidelity qubits. One potential way to circumvent this challenge is through bootstrap embedding (BE). Bootstrap embedding breaks molecules into smaller fragments that are then embedded into the ""bath"" of other fragments in an iterative way. Bootstrap embedding is appealing for quantum simulation because fragmenting the system reduces the qubit requirements for any given fragment. In this work, we develop a quantum bootstrap embedding (QBE) workflow that uses variational quantum eigensolver (VQE) fragment solvers and study the algorithmic choices that determine the overall VQE-QBE algorithm's success. To improve efficiency, we introduce FastAdaptVQE, a sparse matrix-accelerated form of the adaptive variational quantum eigensolver (ADAPT-VQE) that replaces symbolic commutator evaluation with direct statevector linear algebra, and MatrixFreeAdaptVQE, a matrix-free extension that removes the sparse-matrix memory bottleneck that appears when treating larger fragments. We also modify the ADAPT-VQE operator selection step by replacing the purely greedy choice with a look-ahead strategy. Benchmarks on $H_4$ and $F_2$ reach chemical accuracy, within 1 kcal/mol of bootstrap embedding results using a full configuration interaction (FCI) solver. These results show that combining QBE with VQE can accurately calculate energies of molecular systems. This research lays the foundation for extending energy calculations to larger molecular systems and quantum materials on near-term quantum hardware.","['physics.chem-ph', 'quant-ph']",2026-06-13T16:27:00+00:00,https://arxiv.org/pdf/2606.17095v1,arxiv://2606.17095v1,16,20
2606.15061v1,VQE as Initial State Preparation for QPE on Heisenberg Spin-Glass Hamiltonians,"['Elijah Pelofske', 'Stephan Eidenbenz']","Quantum Phase Estimation (QPE) is the quantum algorithmic workhorse for computing ground state energies of quantum Hamiltonians with quantum computers. Ground state energy calculation of physical systems is perhaps the most promising use case for quantum computing in terms of scientific and commercial value with a plausible path to outperformance of classical alternatives. This path, however, hinges on the availability of initial states for QPE with significant overlap with the true ground state. Using extensive (classical) numerical computations, we study whether the NISQ-era algorithm VQE (Variational Quantum Eigensolver) could be used to efficiently prepare high-overlap states of disordered fully-connected anisotropic Heisenberg spin glass quantum Hamiltonians with up to $15$ qubits. We find that (i) -- consistent with widely held, but rarely numerically illustrated beliefs -- VQE is generally unable to efficiently converge to the ground state for our Hamiltonians, which is a well-known issue with VQE due to a variety of factors including vanishing gradients and local minima; (ii) low energy states do not necessarily have large ground-state overlap, but there is typically a correlation between the two measures; (iii) adding more than three layers to the VQE ansatz neither improves overlap nor the energies found; and (iv) the best-found overlap scaling as a function of the Hamiltonian system size is not strongly exponentially decreasing, suggesting potential for VQE to be a heuristic state preparation algorithm for QPE.","['quant-ph', 'cond-mat.dis-nn', 'math.NA']",2026-06-13T02:35:48+00:00,https://arxiv.org/pdf/2606.15061v1,arxiv://2606.15061v1,17,20
2606.14847v1,High-fidelity two-qubit gates in a 7-qubit register for quantum networks,"['Margriet van Riggelen', 'Jiwon Yun', 'H. Benjamin van Ommen', 'Tim H. Taminiau']","Quantum networks based on optically active solid-state spins may enable quantum technologies including long-range quantum communication and distributed quantum computing. Network nodes containing multiple high-fidelity qubits can facilitate large-scale fault-tolerant operation. However, the stringent error thresholds remain out of reach for multi-qubit registers. In this work, we demonstrate high-fidelity two-qubit gates in a 7-qubit register, based on nuclear spins coupled to a nitrogen-vacancy (NV) center in diamond. We analyze crosstalk in highly connected spin systems, develop an efficient optimization procedure, and characterize the gates using gate set tomography. The two-qubit gate fidelities (best: 99.61(5)%, average: 99.18(2)%) demonstrate a multi-qubit register at the threshold for distributed quantum computation. Finally, as an example application, we perform a variational quantum eigensolver (VQE) simulation of the ground-state energy of H2 and LiH molecules. These results demonstrate one of the key prerequisites for scalable quantum networks based on solid-state spins.",['quant-ph'],2026-06-12T18:00:01+00:00,https://arxiv.org/pdf/2606.14847v1,arxiv://2606.14847v1,18,20
2606.13380v1,An LLM System for Autonomous Variational Quantum Circuit Design,"['Kenya Sakka', 'Wataru Mizukami', 'Kosuke Mitarai']","The design of high performing quantum circuits remains largely dependent on human expertise. We introduce an autonomous agentic framework that employs large language models (LLMs) to conduct iterative quantum circuit designs under explicit design constraints. Our system integrates seven components: Exploration, Generation, Discussion, Validation, Storage, Evaluation, and Review. These components form a closed-loop workflow that combines web-based knowledge acquisition, literature-grounded critique, executable code generation, and experimental feedback. We evaluate the framework on two tasks: quantum feature map construction for quantum machine learning and ansatz generation for variational quantum eigensolver applications in quantum chemistry. In image classification benchmarks, the best generated feature map outperforms representative quantum feature maps and, when scaled to larger qubit counts, surpasses the classical radial basis function kernel. In molecular ground state estimation across seven molecules, the generated ansatz attains competitive accuracy with widely used chemically inspired and hardware-efficient constructions while satisfying the imposed scaling constraints. These results establish LLM driven agentic system as a viable paradigm for automated quantum circuit design and illustrate how AI systems can participate in iterative scientific optimization workflows across scientific domains.","['quant-ph', 'cs.AI']",2026-06-11T14:08:00+00:00,https://arxiv.org/pdf/2606.13380v1,arxiv://2606.13380v1,19,20
2606.13118v1,Hamiltonian-Aware ADAPT Variational Quantum Eigensolver for Molecular Ground-State Simulation,"['Runhong He', 'Chao Liu', 'Xin Hong', 'Qiaozhen Chai', 'Junyuan Zhou', 'Ji Guan', 'Guolong Cui', 'Shenggang Ying']","Designing compact ansätze in Variational Quantum Eigensolver (VQE) is crucial for solving energetic problems of practical molecules on near-term quantum devices. However, existing Adaptive Derivative-Assembled Pseudo-Trotter (ADAPT) ansätze face two challenges: improper operator selection and accumulation of degraded operators. In this paper, we propose the Hamiltonian-Aware (HA) ADAPT-VQE algorithm to address these issues. First, we establish a novel excitation operator selection criterion. It breaks the local constraint of existing criteria by incorporating Hamiltonian information, prioritizes physically meaningful excitation operators, and incurs no extra classical or quantum computational overhead. Furthermore, we develop a problem-adaptive method for discriminating and pruning redundant excitation operators stemming from improper selection and inevitable degradation. This method balances redundant operator pruning and convergence guarantee, and is applicable to ansätze with arbitrary scales. Systematic numerical experiments on typical strongly correlated molecular systems demonstrate that our HA-ADAPT-VQE avoids energy plateaus and outperforms baseline algorithms in terms of energy error, ansatz size, and measurement cost. This work offers an efficient, robust ansatz construction paradigm, facilitating the development and practical deployment of large-scale VQE in quantum chemistry.",['quant-ph'],2026-06-11T09:44:41+00:00,https://arxiv.org/pdf/2606.13118v1,arxiv://2606.13118v1,20,20
